{
  "$schema": "http://json-schema.org/draft-07/schema#",
  "$id": "https://prodman.dev/schemas/compiled-spec/v1.json",
  "title": "ProdMan Compiled Spec",
  "description": "Machine-readable product spec generated by `prodman compile`. Structured for AI coding agent consumption.",
  "type": "object",
  "required": [
    "$schema",
    "feature",
    "spec_version",
    "readiness",
    "compiled_at",
    "task_summary",
    "product_context",
    "technical_context",
    "problem",
    "users",
    "in_scope",
    "out_of_scope",
    "requirements",
    "anti_requirements",
    "constraints",
    "acceptance_criteria",
    "edge_cases",
    "definition_of_done",
    "escalation_triggers",
    "context_refs"
  ],
  "additionalProperties": false,
  "properties": {
    "$schema": {
      "type": "string",
      "description": "Schema identifier. Always 'https://prodman.dev/schemas/compiled-spec/v1.json'.",
      "const": "https://prodman.dev/schemas/compiled-spec/v1.json"
    },
    "feature": {
      "type": "string",
      "description": "Kebab-case feature identifier. Matches the features/ folder name.",
      "pattern": "^[a-z0-9]+(-[a-z0-9]+)*$",
      "examples": ["order-history-search", "role-based-onboarding", "checkout-v2"]
    },
    "spec_version": {
      "type": "integer",
      "description": "Monotonically incrementing version. Bumped on each compile.",
      "minimum": 1
    },
    "readiness": {
      "type": "string",
      "description": "Agent-readiness state derived from linter results. 'agent-ready' means all required fields pass lint. 'review-needed' means warnings exist but no blockers. 'incomplete' means required sections are missing.",
      "enum": ["agent-ready", "review-needed", "incomplete"]
    },
    "compiled_at": {
      "type": "string",
      "description": "ISO 8601 UTC timestamp of when this spec was compiled.",
      "format": "date-time"
    },
    "task_summary": {
      "type": "string",
      "description": "1–2 sentences. Exactly what the agent should build or change. Precise about outcome, not implementation.",
      "minLength": 10,
      "maxLength": 500
    },
    "product_context": {
      "type": "object",
      "description": "High-level product and user context from prodman-context/.",
      "required": ["product", "affected_segment"],
      "additionalProperties": false,
      "properties": {
        "product": {
          "type": "string",
          "description": "Brief product description from prodman-context/product.md."
        },
        "affected_segment": {
          "type": "string",
          "description": "Specific user segment(s) impacted by this feature from prodman-context/users.md."
        }
      }
    },
    "technical_context": {
      "type": "object",
      "description": "Technical grounding to orient the agent in the codebase.",
      "required": ["repo", "relevant_files", "stack", "related_systems"],
      "additionalProperties": false,
      "properties": {
        "repo": {
          "type": "string",
          "description": "Repository name or path."
        },
        "relevant_files": {
          "type": "array",
          "description": "Files and modules the agent should focus on.",
          "items": { "type": "string" }
        },
        "stack": {
          "type": "array",
          "description": "Languages, frameworks, and relevant versions.",
          "items": { "type": "string" }
        },
        "related_systems": {
          "type": "array",
          "description": "APIs, databases, or services this task touches.",
          "items": { "type": "string" }
        }
      }
    },
    "problem": {
      "type": "string",
      "description": "The user problem this feature solves. 2–4 sentences.",
      "minLength": 10
    },
    "users": {
      "type": "array",
      "description": "User segments this feature directly affects.",
      "minItems": 1,
      "items": {
        "type": "object",
        "required": ["segment", "description"],
        "additionalProperties": false,
        "properties": {
          "segment": {
            "type": "string",
            "description": "Segment name. Must be specific — not 'users'."
          },
          "description": {
            "type": "string",
            "description": "Who they are and what they're trying to accomplish."
          }
        }
      }
    },
    "in_scope": {
      "type": "array",
      "description": "Specific things to build. Each item should be independently verifiable.",
      "minItems": 1,
      "items": { "type": "string" }
    },
    "out_of_scope": {
      "type": "array",
      "description": "Explicit exclusions. Do not touch these. Prevents scope creep during implementation.",
      "minItems": 1,
      "items": { "type": "string" }
    },
    "requirements": {
      "type": "array",
      "description": "Must-implement requirements. Each must be specific and testable.",
      "minItems": 1,
      "items": { "type": "string" }
    },
    "anti_requirements": {
      "type": "array",
      "description": "Things the agent must NOT do. Explicit constraints on implementation approach.",
      "minItems": 1,
      "items": { "type": "string" }
    },
    "constraints": {
      "type": "object",
      "description": "Non-functional constraints the implementation must satisfy.",
      "required": ["performance", "compliance", "accessibility"],
      "additionalProperties": false,
      "properties": {
        "performance": {
          "type": "string",
          "description": "Latency, throughput, or load requirements. Use 'None specified' if not applicable."
        },
        "compliance": {
          "type": "string",
          "description": "Legal, regulatory, or security constraints. Use 'None specified' if not applicable."
        },
        "accessibility": {
          "type": "string",
          "description": "WCAG level or specific accessibility requirements. Use 'None specified' if not applicable."
        }
      }
    },
    "acceptance_criteria": {
      "type": "array",
      "description": "Testable conditions that must ALL be true for the task to be complete.",
      "minItems": 1,
      "items": {
        "type": "object",
        "required": ["id", "statement", "testable"],
        "additionalProperties": false,
        "properties": {
          "id": {
            "type": "string",
            "description": "Unique identifier. Format: AC-01, AC-02, ...",
            "pattern": "^AC-[0-9]{2,}$"
          },
          "statement": {
            "type": "string",
            "description": "Observable and testable. Starts with 'When' or a specific action."
          },
          "testable": {
            "type": "boolean",
            "description": "Must be true. Untestable criteria are invalid."
          }
        }
      }
    },
    "edge_cases": {
      "type": "array",
      "description": "Scenarios the implementation must explicitly handle.",
      "items": {
        "type": "object",
        "required": ["scenario", "expected"],
        "additionalProperties": false,
        "properties": {
          "scenario": {
            "type": "string",
            "description": "The edge condition."
          },
          "expected": {
            "type": "string",
            "description": "Exact expected behavior."
          }
        }
      }
    },
    "definition_of_done": {
      "type": "array",
      "description": "Checklist of conditions the agent must satisfy before the task is considered complete.",
      "minItems": 1,
      "items": { "type": "string" }
    },
    "escalation_triggers": {
      "type": "array",
      "description": "Conditions under which the agent must stop and ask rather than decide. Empty array is valid only if the spec has zero ambiguous decision points.",
      "items": { "type": "string" }
    },
    "context_refs": {
      "type": "object",
      "description": "Paths to source files that were compiled into this spec.",
      "required": ["product_md", "users_md", "agent_brief_md"],
      "additionalProperties": false,
      "properties": {
        "product_md": {
          "type": "string",
          "description": "Path to prodman-context/product.md"
        },
        "users_md": {
          "type": "string",
          "description": "Path to prodman-context/users.md"
        },
        "tech_md": {
          "type": ["string", "null"],
          "description": "Path to prodman-context/tech.md (optional — generated by VS Code tech detector)"
        },
        "agent_brief_md": {
          "type": "string",
          "description": "Path to features/[feature-name]/agent-brief.md"
        }
      }
    }
  },
  "examples": [
    {
      "$schema": "https://prodman.dev/schemas/compiled-spec/v1.json",
      "feature": "order-history-search",
      "spec_version": 3,
      "readiness": "agent-ready",
      "compiled_at": "2026-03-02T09:15:00Z",
      "task_summary": "Add a keyword search field to the /orders page that filters the displayed order list by order number, item name, or seller name. Results update on each keystroke, debounced at 300ms. No new route — inline filtering on already-loaded data.",
      "product_context": {
        "product": "Mobile-first marketplace where buyers purchase from independent sellers and manage purchase history.",
        "affected_segment": "Mobile checkout repeat buyers (3+ orders/month) who need to locate specific past orders."
      },
      "technical_context": {
        "repo": "marketplace-web",
        "relevant_files": [
          "src/pages/orders/OrdersPage.tsx",
          "src/components/orders/OrderList.tsx",
          "src/types/order.ts",
          "src/hooks/useOrders.ts"
        ],
        "stack": ["React 18", "TypeScript 5", "Tailwind CSS", "React Query"],
        "related_systems": ["GET /api/orders"]
      },
      "problem": "Mobile users cannot find a specific past order without scrolling their entire history. This causes 47 support tickets/week and confirmed repeat purchases users later return.",
      "users": [
        {
          "segment": "Mobile checkout repeat buyers",
          "description": "Users with 3+ orders who need to locate past orders for reordering, tracking, returns, or receipts."
        }
      ],
      "in_scope": [
        "Search input above the order list on /orders",
        "Client-side filtering on order_number, item_name, seller_name (case-insensitive, partial match)",
        "300ms debounce",
        "Empty state when results are empty",
        "Clear button (×) inside the input"
      ],
      "out_of_scope": [
        "Do not modify OrderCard.tsx",
        "Do not modify GET /api/orders or any backend code",
        "Do not add pagination changes",
        "Do not persist search state across page refreshes"
      ],
      "requirements": [
        "Search input renders above order list in OrdersPage.tsx",
        "Filtering applied client-side using debounced value (300ms)",
        "Filtering matches against order_number, item_name, seller_name (case-insensitive, partial match)",
        "Empty state renders when results array is empty with copy including the query",
        "Clear button renders when input has value, hidden when empty"
      ],
      "anti_requirements": [
        "Do not introduce a new route or page for search results",
        "Do not make additional API calls on each keystroke",
        "Do not modify any component outside OrdersPage.tsx, OrderList.tsx, and new SearchInput.tsx"
      ],
      "constraints": {
        "performance": "Filter must complete within 16ms for lists up to 200 orders",
        "compliance": "None specified",
        "accessibility": "Search input must have aria-label='Search orders'. Clear button must have aria-label='Clear search'."
      },
      "acceptance_criteria": [
        {
          "id": "AC-01",
          "statement": "Search input renders on the Orders page, visually above the order list",
          "testable": true
        },
        {
          "id": "AC-02",
          "statement": "Typing in the search field filters visible orders within 300ms (debounced)",
          "testable": true
        },
        {
          "id": "AC-03",
          "statement": "Filtering matches on item_name: searching 'wool coat' shows only orders containing that item",
          "testable": true
        },
        {
          "id": "AC-04",
          "statement": "Empty state renders when filtered results are empty; copy includes the current query",
          "testable": true
        },
        {
          "id": "AC-05",
          "statement": "Clearing the input restores the complete unfiltered order list",
          "testable": true
        }
      ],
      "edge_cases": [
        {
          "scenario": "Query matches zero orders",
          "expected": "Empty state renders with query echoed in copy"
        },
        {
          "scenario": "Query is only whitespace",
          "expected": "Treat as empty — show full list, do not trigger filter"
        },
        {
          "scenario": "Order has null seller_name",
          "expected": "Skip that field in match; do not throw"
        }
      ],
      "definition_of_done": [
        "All acceptance criteria are met",
        "New tests written and passing: filtering logic, debounce, empty state, clear button",
        "No regressions in src/pages/orders/ or src/components/orders/",
        "tsc --noEmit passes",
        "Analytics events orders_search_query and orders_search_cleared instrumented"
      ],
      "escalation_triggers": [
        "If Order type is missing item_name or seller_name fields, stop and ask PM for correct field names",
        "If search persistence via URL param is requested, stop and confirm — this is explicitly out of scope"
      ],
      "context_refs": {
        "product_md": "prodman-context/product.md",
        "users_md": "prodman-context/users.md",
        "tech_md": null,
        "agent_brief_md": "examples/order-history-search/agent-brief.md"
      }
    }
  ]
}
