{
  "$schema": "https://prodman.dev/schemas/compiled-spec/v1.json",
  "feature": "order-history-search",
  "spec_version": 1,
  "readiness": "agent-ready",
  "compiled_at": "2026-03-09T13:22:12.196Z",
  "task_summary": "Add a keyword search field to the `/orders` page that filters the displayed order list by order number, item name, or seller name. Results update on each keystroke, debounced at 300ms. No new page or route — the search operates inline on the existing order list component.",
  "product_context": {
    "product": "A mobile-first marketplace where buyers can purchase from independent sellers and manage their purchase history.",
    "affected_segment": "Mobile checkout users who place 3+ orders per month and need to locate specific past orders for reordering, returns, or receipts."
  },
  "technical_context": {
    "repo": "marketplace-web",
    "relevant_files": [
      "src/pages/orders/OrdersPage.tsx — main page component; renders <OrderList />",
      "src/components/orders/OrderList.tsx — renders the list of order cards",
      "src/components/orders/OrderCard.tsx — individual order card (read-only, do not modify)",
      "src/hooks/useOrders.ts — fetches and returns Order[]",
      "src/types/order.ts — Order type definition",
      "GET /api/orders — existing endpoint, returns all orders for current user",
      "**Tech stack:** React 18, TypeScript 5, Tailwind CSS, React Query, Jest + React Testing Library"
    ],
    "stack": [],
    "related_systems": []
  },
  "problem": "",
  "users": [],
  "in_scope": [
    "Search input component rendered above the order list on `/orders`",
    "Client-side filtering of the order list on `order_number`, `item_name`, `seller_name` fields",
    "Debounce at 300ms",
    "Empty state when no results match the query",
    "Clear button inside the search input (appears when input has value)"
  ],
  "out_of_scope": [
    "Do NOT modify `OrderCard.tsx`",
    "Do NOT modify `GET /api/orders` or any backend code",
    "Do NOT add pagination changes",
    "Do NOT persist search state across page refreshes",
    "Do NOT add date, price, or status filters"
  ],
  "requirements": [
    "Search input renders above the order list in `OrdersPage.tsx`",
    "Filtering is applied client-side using a debounced value (300ms) of the search input",
    "Filtering matches against `order.order_number`, `order.item_name`, `order.seller_name` (case-insensitive, partial match)",
    "When results array is empty, render an `<EmptyState>` component with copy: \"No orders match '[query]'. Try a different search.\"",
    "Clearing the search input (or clicking the clear button) restores the full order list",
    "The clear button (×) renders inside the input field when value is non-empty, and is hidden when value is empty"
  ],
  "anti_requirements": [
    "Do NOT introduce a new route or page for search results",
    "Do NOT make additional API calls on each keystroke — filter the already-loaded data",
    "Do NOT modify any component outside `OrdersPage.tsx`, `OrderList.tsx`, and the new `SearchInput.tsx`",
    "Do NOT change the order list sorting"
  ],
  "constraints": {
    "performance": "Filter must complete within 16ms for lists up to 200 orders (1 render frame budget)",
    "compliance": "None specified",
    "accessibility": "Search input must have a visible label or `aria-label=\"Search orders\"`. Clear button must have `aria-label=\"Clear search\"`."
  },
  "acceptance_criteria": [
    {
      "id": "AC-01",
      "statement": "Search input renders on the Orders page, visually above the order list",
      "testable": true
    },
    {
      "id": "AC-02",
      "statement": "Typing in the search field filters the visible orders within 300ms (debounced)",
      "testable": true
    },
    {
      "id": "AC-03",
      "statement": "Filtering matches on `order_number` field: searching \"ORD-1042\" shows only orders with that number",
      "testable": true
    },
    {
      "id": "AC-04",
      "statement": "Filtering matches on `item_name` field: searching \"wool coat\" shows orders containing that item",
      "testable": true
    },
    {
      "id": "AC-05",
      "statement": "Filtering matches on `seller_name` field: searching \"acme\" shows orders from sellers whose name contains \"acme\"",
      "testable": true
    },
    {
      "id": "AC-06",
      "statement": "Matching is case-insensitive (\"ACME\" and \"acme\" both match)",
      "testable": true
    },
    {
      "id": "AC-07",
      "statement": "Empty state renders when the filtered results array is empty; copy includes the current query",
      "testable": true
    },
    {
      "id": "AC-08",
      "statement": "Clearing the input field or clicking ×  restores the complete unfiltered order list",
      "testable": true
    },
    {
      "id": "AC-09",
      "statement": "Clear button (×) is visible when the input has a value, hidden when empty",
      "testable": true
    },
    {
      "id": "AC-10",
      "statement": "All existing tests in `src/pages/orders/` and `src/components/orders/` pass without modification",
      "testable": true
    },
    {
      "id": "AC-11",
      "statement": "New unit tests cover: filtering logic, debounce behavior, empty state render, clear action",
      "testable": true
    }
  ],
  "edge_cases": [
    {
      "scenario": "Query matches zero orders",
      "expected": "Empty state renders with query echoed in copy"
    },
    {
      "scenario": "Query is only whitespace",
      "expected": "Treat as empty — show full list, do not trigger filter"
    },
    {
      "scenario": "Order has no `seller_name` (null/undefined)",
      "expected": "Skip that field in match; do not throw"
    },
    {
      "scenario": "User types very fast (< 300ms between keystrokes)",
      "expected": "Debounce resets; filter fires only after 300ms of inactivity"
    },
    {
      "scenario": "Order list is empty (user has no orders)",
      "expected": "Existing empty state renders; search input does not render"
    },
    {
      "scenario": "Query is a single character",
      "expected": "Filter applies normally"
    }
  ],
  "definition_of_done": [
    "All acceptance criteria above are met",
    "New tests written and passing: filtering logic, debounce, empty state, clear button",
    "No regressions in `src/pages/orders/` or `src/components/orders/` test suites",
    "No new TypeScript errors (`tsc --noEmit` passes)",
    "Analytics events instrumented:",
    "`orders_search_query` fired when a debounced query is applied (include `query_length`, `result_count`)",
    "`orders_search_cleared` fired when input is cleared"
  ],
  "escalation_triggers": [
    "Search should persist across page refreshes (e.g., via URL param `?q=`) — this is NOT specified, confirm before adding",
    "Mobile layout needs different treatment than desktop (e.g., collapsible search bar) — not specified, do not add without confirmation",
    "The `Order` type is missing `item_name` or `seller_name` fields in `src/types/order.ts` — confirm correct field names before proceeding"
  ],
  "context_refs": {
    "product_md": "prodman-context\\product.md",
    "users_md": "prodman-context\\users.md",
    "tech_md": null,
    "agent_brief_md": "C:\\Users\\Vissu\\OneDrive\\Documents\\Claude\\ProdMan\\examples\\order-history-search\\agent-brief.md"
  }
}